root@yuki-virtual-machine:/home/yuki# usbhid-dump --model=0079
002:004:000:DESCRIPTOR         1558342362.330051
 05 01 09 05 A1 01 85 02 05 09 09 01 09 02 09 09
 09 04 09 05 09 0A 09 07 09 08 15 00 25 01 75 01
 95 08 81 02 05 07 09 66 09 80 05 09 09 0C 09 10
 09 0D 09 0E 09 0F 05 07 09 81 15 00 25 01 75 01
 95 08 81 02 05 01 15 00 25 07 46 3B 01 95 01 75
 04 65 14 09 39 81 42 75 01 95 04 81 01 05 01 15
 00 26 FF 00 09 30 09 31 09 32 09 35 95 04 75 08
 81 02 05 02 15 00 26 FF 00 09 C4 09 C5 95 02 75
 08 81 02 C0 05 01 09 06 A1 01 85 04 75 01 95 08
 05 07 19 E0 29 E7 15 00 25 01 81 02 75 01 95 08
 05 0C 09 CD 09 B6 09 B5 09 B4 09 B3 0A 23 02 0A
 24 02 09 40 15 00 25 01 81 02 95 05 75 01 05 08
 19 01 29 05 91 02 95 01 75 03 91 03 95 06 75 08
 15 00 26 FF 00 05 07 19 00 29 FF 81 00 C0

