root@yuki-virtual-machine:/home/yuki# usbhid-dump --model=0079
002:004:000:DESCRIPTOR         1558342362.330051
 05 01 09 05 A1 01 85 02 05 09 09 01 09 02 09 09
 09 04 09 05 09 0A 09 07 09 08 15 00 25 01 75 01
 95 08 81 02 05 07 09 66 09 80 05 09 09 0C 09 10
 09 0D 09 0E 09 0F 05 07 09 81 15 00 25 01 75 01
 95 08 81 02 05 01 15 00 25 07 46 3B 01 95 01 75
 04 65 14 09 39 81 42 75 01 95 04 81 01 05 01 15
 00 26 FF 00 09 30 09 31 09 32 09 35 95 04 75 08
 81 02 05 02 15 00 26 FF 00 09 C4 09 C5 95 02 75
 08 81 02 C0 05 01 09 06 A1 01 85 04 75 01 95 08
 05 07 19 E0 29 E7 15 00 25 01 81 02 75 01 95 08
 05 0C 09 CD 09 B6 09 B5 09 B4 09 B3 0A 23 02 0A
 24 02 09 40 15 00 25 01 81 02 95 05 75 01 05 08
 19 01 29 05 91 02 95 01 75 03 91 03 95 06 75 08
 15 00 26 FF 00 05 07 19 00 29 FF 81 00 C0

// update
# echo '05 01 09 05 A1 01 85 02 05 09 09 01 09 02 09 09 09 04 09 05 09 0A 09 07 09 08 15 00 25 01 75 01 95 08 81 02 05 07 09 66 09 80 05 09 09 0C 09 10 09 0D 09 0E 09 0F 05 07 09 81 15 00 25 01 75 01 95 08 81 02 05 01 15 00 25 07 46 3B 01 95 01 75 04 65 14 09 39 81 42 75 01 95 04 81 01 05 01 15 00 26 FF 00 09 30 09 31 09 32 09 35 95 04 75 08 81 02 05 02 15 00 26 FF 00 09 C4 09 C5 95 02 75 08 81 02 C0 05 01 09 06 A1 01 85 04 75 01 95 08 05 07 19 E0 29 E7 15 00 25 01 81 02 75 01 95 08 05 0C 09 CD 09 B6 09 B5 09 B4 09 B3 0A 23 02 0A 24 02 09 40 15 00 25 01 81 02 95 05 75 01 05 08 19 01 29 05 91 02 95 01 75 03 91 03 95 06 75 08 15 00 26 FF 00 05 07 19 00 29 FF 81 00 C0'| xxd -r -p | hidrd-convert -o spec

Usage Page (Desktop),               ; Generic desktop controls (01h)
Usage (Gamepad),                    ; Gamepad (05h, application collection)
Collection (Application),
    Report ID (2),
    Usage Page (Button),            ; Button (09h)
    Usage (01h),
    Usage (02h),
    Usage (09h),
    Usage (04h),
    Usage (05h),
    Usage (0Ah),
    Usage (07h),
    Usage (08h),
    Logical Minimum (0),
    Logical Maximum (1),
    Report Size (1),
    Report Count (8),
    Input (Variable),
    Usage Page (Keyboard),          ; Keyboard/keypad (07h)
    Usage (KB Power),               ; Keyboard Power (66h, selector)
    Usage (KB Volume Up),           ; Keyboard Volume Up (80h, selector)
    Usage Page (Button),            ; Button (09h)
    Usage (0Ch),
    Usage (10h),
    Usage (0Dh),
    Usage (0Eh),
    Usage (0Fh),
    Usage Page (Keyboard),          ; Keyboard/keypad (07h)
    Usage (KB Volume Down),         ; Keyboard Volume Down (81h, selector)
    Logical Minimum (0),
    Logical Maximum (1),
    Report Size (1),
    Report Count (8),
    Input (Variable),
    Usage Page (Desktop),           ; Generic desktop controls (01h)
    Logical Minimum (0),
    Logical Maximum (7),
    Physical Maximum (315),
    Report Count (1),
    Report Size (4),
    Unit (Degrees),
    Usage (Hat Switch),             ; Hat switch (39h, dynamic value)
    Input (Variable, Null State),
    Report Size (1),
    Report Count (4),
    Input (Constant),
    Usage Page (Desktop),           ; Generic desktop controls (01h)
    Logical Minimum (0),
    Logical Maximum (255),
    Usage (X),                      ; X (30h, dynamic value)
    Usage (Y),                      ; Y (31h, dynamic value)
    Usage (Z),                      ; Z (32h, dynamic value)
    Usage (Rz),                     ; Rz (35h, dynamic value)
    Report Count (4),
    Report Size (8),
    Input (Variable),
    Usage Page (Simulation),        ; Simulation controls (02h)
    Logical Minimum (0),
    Logical Maximum (255),
    Usage (C4h),
    Usage (C5h),
    Report Count (2),
    Report Size (8),
    Input (Variable),
End Collection,
Usage Page (Desktop),               ; Generic desktop controls (01h)
Usage (Keyboard),                   ; Keyboard (06h, application collection)
Collection (Application),
    Report ID (4),
    Report Size (1),
    Report Count (8),
    Usage Page (Keyboard),          ; Keyboard/keypad (07h)
    Usage Minimum (KB Leftcontrol), ; Keyboard left control (E0h, dynamic value)
    Usage Maximum (KB Right GUI),   ; Keyboard right GUI (E7h, dynamic value)
    Logical Minimum (0),
    Logical Maximum (1),
    Input (Variable),
    Report Size (1),
    Report Count (8),
    Usage Page (Consumer),          ; Consumer (0Ch)
    Usage (Play Pause),             ; Play/pause (CDh, one-shot control)
    Usage (Scan Previous Track),    ; Scan previous track (B6h, one-shot control)
    Usage (Scan Next Track),        ; Scan next track (B5h, one-shot control)
    Usage (Rewind),                 ; Rewind (B4h, on/off control)
    Usage (Fast Forward),           ; Fast forward (B3h, on/off control)
    Usage (AC Home),                ; AC home (0223h, selector)
    Usage (AC Back),                ; AC back (0224h, selector)
    Usage (Menu),                   ; Menu (40h, on/off control)
    Logical Minimum (0),
    Logical Maximum (1),
    Input (Variable),
    Report Count (5),
    Report Size (1),
    Usage Page (LED),               ; LEDs (08h)
    Usage Minimum (01h),
    Usage Maximum (05h),
    Output (Variable),
    Report Count (1),
    Report Size (3),
    Output (Constant, Variable),
    Report Count (6),
    Report Size (8),
    Logical Minimum (0),
    Logical Maximum (255),
    Usage Page (Keyboard),          ; Keyboard/keypad (07h)
    Usage Minimum (None),           ; No event (00h, selector)
    Usage Maximum (FFh),
    Input,
End Collection
